{
  "schemaVersion": 1,
  "packId": "atlas.reader-guide",
  "documents": [
    {
      "id": "doc.atlas.pdf",
      "pageId": "page.atlas.pdf",
      "title": "PDF reading fixture",
      "source": {
        "kind": "pack-file",
        "path": "assets/atlas-reader-fixture.pdf"
      },
      "sha256": "0eea0f025b7a63a0c83ee83bafdef900d3bf4ab99ff39db1122eea16ad17c1af",
      "bytes": 50938,
      "pageCount": 5,
      "visibility": "public",
      "rights": {
        "status": "author-created",
        "attribution": "Original synthetic Knowledge Atlas PDF fixture supplied in the MegaPack."
      },
      "defaultView": "single"
    },
    {
      "id": "doc.atlas.rotated",
      "pageId": "page.atlas.rotated",
      "title": "Rotated PDF fixture",
      "source": {
        "kind": "pack-file",
        "path": "assets/atlas-reader-rotated-fixture.pdf"
      },
      "sha256": "d6633f587f1f36026058c9fbf11d9761c0aab70b9d90224ece4a5aa96786330e",
      "bytes": 50862,
      "pageCount": 5,
      "visibility": "public",
      "rights": {
        "status": "author-created",
        "attribution": "Original synthetic Knowledge Atlas PDF fixture supplied in the MegaPack."
      },
      "defaultView": "single"
    },
    {
      "id": "doc.atlas.password",
      "pageId": "page.atlas.password",
      "title": "Password-protected PDF fixture",
      "source": {
        "kind": "pack-file",
        "path": "assets/atlas-reader-password-fixture.pdf"
      },
      "sha256": "a969df047c1ad3ecd0e0ee8fc5ebc3d787bd5bfad5af4d17e1bb8acdf14b47ae",
      "bytes": 51414,
      "pageCount": 5,
      "visibility": "public",
      "rights": {
        "status": "author-created",
        "attribution": "Original synthetic Knowledge Atlas PDF fixture supplied in the MegaPack."
      },
      "defaultView": "single"
    }
  ],
  "format": "atlas-document-index",
  "version": "1.0.1"
}
